Blaramberg,  Johann von;Blaramberg; Johann von; Johann von Blaramberg;1772;1832;http://viaf.org/viaf/35583533;http://viaf.org/viaf/;35583533;KM 18.03.1830 ;OM 11.01.1830 ;;Pezzana,  Angelo;Pezzana; Angelo; Angelo Pezzana;1772;1862;http://viaf.org/viaf/57358661;http://viaf.org/viaf/;57358661;KM 26.04.1860 ;;;Brown,  Robert;Brown; Robert; Robert Brown;1773;1858;http://viaf.org/viaf/34572082;http://viaf.org/viaf/;34572082;KM 25.06.1812  bis 13.02.1834;AM 20.03.1834 ;;Fries,  Jakob Friedrich;Fries; Jakob Friedrich; Jakob Friedrich Fries;1773;1843;http://viaf.org/viaf/2548699;http://viaf.org/viaf/;2548699;KM 25.06.1812 ;;;Mohs,  Friedrich;Mohs; Friedrich; Friedrich Mohs;1773;1839;http://viaf.org/viaf/59115850;http://viaf.org/viaf/;59115850;KM 25.06.1812 ;;;Pfaff,  Christoph Heinrich;Pfaff; Christoph Heinrich; Christoph Heinrich Pfaff;1773;1852;http://viaf.org/viaf/17966308;http://viaf.org/viaf/;17966308;KM 25.06.1812 ;;;Sismondi, J.-C.-L. Simonde de (Jean-Charles-Leçonard Simonde);Sismondi;J.-C.-L. Simonde de (Jean-Charles-Leçonard Simonde);J.-C.-L. Simonde de (Jean-Charles-Leçonard Simonde) Sismondi;1773;1842;http://viaf.org/viaf/95159682;http://viaf.org/viaf/;95159682;KM 25.06.1812 ;;;Brown,  Robert;Brown; Robert; Robert Brown;1773;1858;http://viaf.org/viaf/34572082;http://viaf.org/viaf/;34572082;KM 25.06.1812  bis 13.02.1834;AM 20.03.1834 ;;Bowditsch,  Nathaniel;Bowditsch; Nathaniel; Nathaniel Bowditsch;1773;1838;http://viaf.org/viaf/29701293;http://viaf.org/viaf/;29701293;KM 24.03.1836 ;;;Buch,  Leopold von (Christian Leopold);Buch; Leopold von (Christian Leopold); Leopold von (Christian Leopold) Buch;1774;1853;http://viaf.org/viaf/24903848;http://viaf.org/viaf/;24903848;auﬂerord. M 27.03.1806 bis 04.08.1808 ;OM 15.08.1808 ;;Heindorf,  Ludwig Friedrich;Heindorf; Ludwig Friedrich; Ludwig Friedrich Heindorf;1774;1816;http://viaf.org/viaf/20437272;http://viaf.org/viaf/;20437272;KM 25.06.1812 ;;;Hammer-Purgstall,  Joseph Freiherr von;Hammer-Purgstall; Joseph Freiherr von; Joseph Freiherr von Hammer-Purgstall;1774;1856;http://viaf.org/viaf/24719722;http://viaf.org/viaf/;24719722;KM 17.03.1814 ;;;Biot,  Jean Baptiste;Biot; Jean Baptiste; Jean Baptiste Biot;1774;1862;http://viaf.org/viaf/71428323;http://viaf.org/viaf/;71428323;KM 01.06.1820  bis 07.02.1850;AM 07.02.1850 ;;Jameson,  Robert;Jameson; Robert; Robert Jameson;1774;1854;http://viaf.org/viaf/19895365;http://viaf.org/viaf/;19895365;KM 01.06.1820 ;;;Freiesleben, Johann Carl;Freiesleben;Johann Carl;Johann Carl Freiesleben;1774;1846;http://viaf.org/viaf/84101408;http://viaf.org/viaf/;84101408;KM 13.12.1827 ;;;Fuchs,  Johann Nepomuk von;Fuchs; Johann Nepomuk von; Johann Nepomuk von Fuchs;1774;1856;http://viaf.org/viaf/22903849;http://viaf.org/viaf/;22903849;KM 13.02.1834 ;;;Millingen,  James;Millingen; James; James Millingen;1774;1845;http://viaf.org/viaf/49215378;http://viaf.org/viaf/;49215378;KM 13.02.1840 ;;;Baily,  Francis;Baily; Francis; Francis Baily;1774;1844;http://viaf.org/viaf/37072338;http://viaf.org/viaf/;37072338;KM 03.02.1842 ;;;Biot,  Jean Baptiste;Biot; Jean Baptiste; Jean Baptiste Biot;1774;1862;http://viaf.org/viaf/71428323;http://viaf.org/viaf/;71428323;KM 01.06.1820  bis 07.02.1850;AM 07.02.1850 ;;Illiger,  Karl;Illiger; Karl; Karl Illiger;1775;1813;http://viaf.org/viaf/27840543;http://viaf.org/viaf/;27840543;OM 07.04.1810 ;;;Süvern, Johann Wilhelm;Süvern;Johann Wilhelm;Johann Wilhelm Süvern;1775;1829;http://viaf.org/viaf/67258537;http://viaf.org/viaf/;67258537;OM 03.05.1815 ;;;Thorlacius, B¯rge;Thorlacius;B¯rge;B¯rge Thorlacius;1775;1829;http://viaf.org/viaf/13082945;http://viaf.org/viaf/;13082945;KM 28.02.1822 ;;;Müffling,  Karl Freiherr von;Müffling; Karl Freiherr von; Karl Freiherr von Müffling;1775;1851;http://viaf.org/viaf/17363462;http://viaf.org/viaf/;17363462;EM 23.06.1823 ;;;Ampere,  André-Marie;Ampere; André-Marie; André-Marie Ampere;1775;1836;http://viaf.org/viaf/41858701;http://viaf.org/viaf/;41858701;KM 13.12.1827 ;;;Klug,  Friedrich;Klug; Friedrich; Friedrich Klug;1775;1856;http://viaf.org/viaf/49971728;http://viaf.org/viaf/;49971728;OM 10.12.1829 ;;;Schelling,  Friedrich Wilhelm Joseph von;Schelling; Friedrich Wilhelm Joseph von; Friedrich Wilhelm Joseph von Schelling;1775;1854;http://viaf.org/viaf/88933257;http://viaf.org/viaf/;88933257;AM 07.05.1832  bis 03.12.1842;OM 03.12.1842 ;;Schelling,  Friedrich Wilhelm Joseph von;Schelling; Friedrich Wilhelm Joseph von; Friedrich Wilhelm Joseph von Schelling;1775;1854;http://viaf.org/viaf/88933257;http://viaf.org/viaf/;88933257;AM 07.05.1832  bis 03.12.1842;OM 03.12.1842 ;;Labus,  Giovanni;Labus; Giovanni; Giovanni Labus;1775;1853;http://viaf.org/viaf/12297351;http://viaf.org/viaf/;12297351;KM 02.03.1843 ;;;Grotefend,  Georg Friedrich;Grotefend; Georg Friedrich; Georg Friedrich Grotefend;1775;1853;http://viaf.org/viaf/47556864;http://viaf.org/viaf/;47556864;KM 15.04.1847 ;;;Niebuhr,  Barthold Georg;Niebuhr; Barthold Georg; Barthold Georg Niebuhr;1776;1831;http://viaf.org/viaf/7521573;http://viaf.org/viaf/;7521573;OM 07.04.1810 ;;;Treviranus,  Gottfried Reinhold;Treviranus; Gottfried Reinhold; Gottfried Reinhold Treviranus;1776;1837;http://viaf.org/viaf/47557694;http://viaf.org/viaf/;47557694;KM 25.06.1812 ;;;Stromeyer,  Friedrich;Stromeyer; Friedrich; Friedrich Stromeyer;1776;1835;http://viaf.org/viaf/17997456;http://viaf.org/viaf/;17997456;EM 19.08.1818 ;;;Münster,  Georg zu;Münster; Georg zu; Georg zu Münster;1776;1844;http://viaf.org/viaf/54981206;http://viaf.org/viaf/;54981206;EM 04.01.1837 ;;;Gauss,  Karl Friedrich;Gauss; Karl Friedrich; Karl Friedrich Gauss;1777;1855;http://viaf.org/viaf/29534259;http://viaf.org/viaf/;29534259;AM 18.07.1810  bis 11.11.1824;OM 11.11.1824 ;;Wilken,  Friedrich;Wilken; Friedrich; Friedrich Wilken;1777;1840;http://viaf.org/viaf/72169805;http://viaf.org/viaf/;72169805;KM 25.06.1812  bis 26.11.1818;OM 01.01.1819 ;;Theçnard, Louis Jacques, baron;Theçnard;Louis Jacques, baron;Louis Jacques, baron Theçnard;1777;1857;http://viaf.org/viaf/56695277;http://viaf.org/viaf/;56695277;KM 25.06.1812  bis 26.07.1855;AM 15.08.1855 ;;Gell,  Sir William;Gell; Sir William; Sir William Gell;1777;1836;http://viaf.org/viaf/10148614;http://viaf.org/viaf/;10148614;KM 22.06.1815 ;;;Hamilton,  William Richard;Hamilton; William Richard; William Richard Hamilton;1777;1859;http://viaf.org/viaf/66896160;http://viaf.org/viaf/;66896160;EM 22.06.1815 ;;;Leake,  William Martin;Leake; William Martin; William Martin Leake;1777;1860;http://viaf.org/viaf/27833332;http://viaf.org/viaf/;27833332;EM 22.06.1815 ;;;Configliachi,  Pietro;Configliachi; Pietro; Pietro Configliachi;1777;1844;http://viaf.org/viaf/69714120;http://viaf.org/viaf/;69714120;KM 25.06.1818 ;;;Wilken,  Friedrich;Wilken; Friedrich; Friedrich Wilken;1777;1840;http://viaf.org/viaf/72169805;http://viaf.org/viaf/;72169805;KM 25.06.1812  bis 26.11.1818;OM 01.01.1819 ;;Furia,  Francesco del;Furia; Francesco del; Francesco del Furia;1777;1856;http://viaf.org/viaf/13069904;http://viaf.org/viaf/;13069904;KM 04.02.1819 ;;;Kumas, Könstantinos Michaeçl;Kumas;Könstantinos Michaeçl;Könstantinos Michaeçl Kumas;1777;1836;http://viaf.org/viaf/69731641;http://viaf.org/viaf/;69731641;KM 09.12.1819 ;;;Oersted,  Hans Christian;Oersted; Hans Christian; Hans Christian Oersted;1777;1851;http://viaf.org/viaf/39490755;http://viaf.org/viaf/;39490755;KM 23.11.1820 ;;;Clarac, Charles Othon Frédéric Jean Baptiste, comte de;Clarac;Charles Othon Frédéric Jean Baptiste, comte de;Charles Othon Frédéric Jean Baptiste, comte de Clarac;1777;1847;http://viaf.org/viaf/22357212;http://viaf.org/viaf/;22357212;KM 16.08.1821 ;;;Jomard,  Edmond-Françﬂois;Jomard; Edmond-Françﬂois; Edmond-Françﬂois Jomard;1777;1862;http://viaf.org/viaf/2511766;http://viaf.org/viaf/;2511766;KM 16.08.1821 ;;;Gauss,  Karl Friedrich;Gauss; Karl Friedrich; Karl Friedrich Gauss;1777;1855;http://viaf.org/viaf/29534259;http://viaf.org/viaf/;29534259;AM 18.07.1810  bis 11.11.1824;OM 11.11.1824 ;;Savigny, Marie Jules Ceçsar Lelorgne de;Savigny;Marie Jules Ceçsar Lelorgne de;Marie Jules Ceçsar Lelorgne de Savigny;1777;1851;http://viaf.org/viaf/51829073;http://viaf.org/viaf/;51829073;KM 13.04.1826 ;;;Costa de macedo, Joaquim José ;Costa de macedo;Joaquim José ;Joaquim José  Costa de macedo;1777;1867;http://viaf.org/viaf/30292606;http://viaf.org/viaf/;30292606;KM 15.02.1838 ;;;Pickering,  John;Pickering; John; John Pickering;1777;1846;http://viaf.org/viaf/29695025;http://viaf.org/viaf/;29695025;KM 13.02.1840 ;;;Dureau de la malle,  Adolphe-Jules-César-Auguste;Dureau de la malle; Adolphe-Jules-César-Auguste; Adolphe-Jules-César-Auguste Dureau de la malle;1777;1857;http://viaf.org/viaf/99779253;http://viaf.org/viaf/;99779253;KM 15.04.1847 ;;;Duvernoy,  Georges-Louis;Duvernoy; Georges-Louis; Georges-Louis Duvernoy;1777;1855;http://viaf.org/viaf/71382017;http://viaf.org/viaf/;71382017;KM 27.04.1854 ;;;Thénard,  Louis-Jacques, baron;Thénard; Louis-Jacques, baron; Louis-Jacques, baron Thénard;1777;1857;http://viaf.org/viaf/56695277;http://viaf.org/viaf/;56695277;KM 25.06.1812 bis 26.07.1855 ;AM 15.08.1855 ;;Poinsot,  Louis;Poinsot; Louis; Louis Poinsot;1777;1859;http://viaf.org/viaf/4935248;http://viaf.org/viaf/;4935248;KM 22.07.1858 ;;;Davy,  Sir Humphry;Davy; Sir Humphry; Sir Humphry Davy;1778;1829;http://viaf.org/viaf/29630108;http://viaf.org/viaf/;29630108;AM 16.07.1812 ;;;Gay-Lussac,  Louis-Joseph;Gay-Lussac; Louis-Joseph; Louis-Joseph Gay-Lussac;1778;1850;http://viaf.org/viaf/41893883;http://viaf.org/viaf/;41893883;KM 25.06.1812  bis 07.04.1842;AM 28.06.1842 ;;Heusde,  Philipp Willem van;Heusde; Philipp Willem van; Philipp Willem van Heusde;1778;1839;http://viaf.org/viaf/95188373;http://viaf.org/viaf/;95188373;KM 25.06.1812 ;;;Göschen,  Johann Friedrich Ludwig;Göschen; Johann Friedrich Ludwig; Johann Friedrich Ludwig Göschen;1778;1837;http://viaf.org/viaf/36417344;http://viaf.org/viaf/;36417344;KM 26.06.1817 ;;;Candolle, Augustin Pyrame de;Candolle;Augustin Pyrame de;Augustin Pyrame de Candolle;1778;1841;http://viaf.org/viaf/76389959;http://viaf.org/viaf/;76389959;KM 13.12.1827 ;;;Gay-Lussac,  Louis-Joseph;Gay-Lussac; Louis-Joseph; Louis-Joseph Gay-Lussac;1778;1850;http://viaf.org/viaf/41893883;http://viaf.org/viaf/;41893883;KM 25.06.1812  bis 07.04.1842;AM 28.06.1842 ;;Temminck,  Coenraad Jacob;Temminck; Coenraad Jacob; Coenraad Jacob Temminck;1778;1858;http://viaf.org/viaf/69703180;http://viaf.org/viaf/;69703180;EM 10.12.1855 ;;;Savigny,  Friedrich Karl von;Savigny; Friedrich Karl von; Friedrich Karl von Savigny;1779;1861;http://viaf.org/viaf/76377829;http://viaf.org/viaf/;76377829;OM 29.04.1811 ;;;Berzelius,  Johann Jakob;Berzelius; Johann Jakob; Johann Jakob Berzelius;1779;1848;http://viaf.org/viaf/41868753;http://viaf.org/viaf/;41868753;KM 25.06.1812  bis 16.06.1825;AM 28.06.1825 ;;Ritter,  Karl ;Ritter; Karl ; Karl  Ritter;1779;1859;http://viaf.org/viaf/56673426;http://viaf.org/viaf/;56673426;OM 18.04.1822 ;;;Berzelius,  Johann Jakob;Berzelius; Johann Jakob; Johann Jakob Berzelius;1779;1848;http://viaf.org/viaf/41868753;http://viaf.org/viaf/;41868753;KM 25.06.1812  bis 16.06.1825;AM 28.06.1825 ;;Lindenau,  Bernhard August von;Lindenau; Bernhard August von; Bernhard August von Lindenau;1779;1854;http://viaf.org/viaf/39418848;http://viaf.org/viaf/;39418848;EM 04.01.1828 ;;;Hase,  Benedikt;Hase; Benedikt; Benedikt Hase;1780;1864;http://viaf.org/viaf/29832920;http://viaf.org/viaf/;29832920;KM 25.06.1812  bis 25.04.1850;AM 18.05.1850 ;;Tenore,  Michele;Tenore; Michele; Michele Tenore;1780;1861;http://viaf.org/viaf/29523124;http://viaf.org/viaf/;29523124;KM 25.06.1812 ;;;Wahlenberg,  Göran;Wahlenberg; Göran; Göran Wahlenberg;1780;1851;http://viaf.org/viaf/73969032;http://viaf.org/viaf/;73969032;KM 17.03.1814 ;;;Lichtenstein,  Hinrich;Lichtenstein; Hinrich; Hinrich Lichtenstein;1780;1857;http://viaf.org/viaf/66680249;http://viaf.org/viaf/;66680249;OM 14.05.1814 ;;;Weiss,  Christian Samuel;Weiss; Christian Samuel; Christian Samuel Weiss;1780;1856;http://viaf.org/viaf/3267246;http://viaf.org/viaf/;3267246;OM 03.05.1815 ;;;Brönsted,  Peter Oluf;Brönsted; Peter Oluf; Peter Oluf Brönsted;1780;1842;http://viaf.org/viaf/64136808;http://viaf.org/viaf/;64136808;KM 22.06.1815 ;;;Schumacher,  Heinrich Christian;Schumacher; Heinrich Christian; Heinrich Christian Schumacher;1780;1850;http://viaf.org/viaf/51695714;http://viaf.org/viaf/;51695714;KM 22.06.1826 ;;;Crelle,  August Leopold;Crelle; August Leopold; August Leopold Crelle;1780;1855;http://viaf.org/viaf/42596350;http://viaf.org/viaf/;42596350;OM 23.08.1827 ;;;Graff,  Eberhard Gottlieb;Graff; Eberhard Gottlieb; Eberhard Gottlieb Graff;1780;1841;http://viaf.org/viaf/56682761;http://viaf.org/viaf/;56682761;KM 12.04.1832  bis 29.11.1832;OM 03.01.1833 ;;Graff,  Eberhard Gottlieb;Graff; Eberhard Gottlieb; Eberhard Gottlieb Graff;1780;1841;http://viaf.org/viaf/56682761;http://viaf.org/viaf/;56682761;KM 12.04.1832  bis 29.11.1832;OM 03.01.1833 ;;Oikonömos, Könstantiçnos;Oikonömos;Könstantiçnos;Könstantiçnos Oikonömos;1780;1857;http://viaf.org/viaf/17443285;http://viaf.org/viaf/;17443285;KM 13.12.1832 ;;;Döbereiner,  Johann Wolfgang;Döbereiner; Johann Wolfgang; Johann Wolfgang Döbereiner;1780;1849;http://viaf.org/viaf/62340086;http://viaf.org/viaf/;62340086;KM 19.02.1835 ;;;Kopitar,  Bartholomäus;Kopitar; Bartholomäus; Bartholomäus Kopitar;1780;1844;http://viaf.org/viaf/12323678;http://viaf.org/viaf/;12323678;KM 23.06.1836 ;;;Hagen,  Friedrich Heinrich von der;Hagen; Friedrich Heinrich von der; Friedrich Heinrich von der Hagen;1780;1856;http://viaf.org/viaf/95213853;http://viaf.org/viaf/;95213853;OM 09.03.1841 ;;;Rühle von Lilienstern,  Johann Jakob Otto August;Rühle von Lilienstern; Johann Jakob Otto August; Johann Jakob Otto August Rühle von Lilienstern;1780;1847;http://viaf.org/viaf/27828907;http://viaf.org/viaf/;27828907;EM 06.05.1846 ;;;Hase,  Benedikt;Hase; Benedikt; Benedikt Hase;1780;1864;http://viaf.org/viaf/29832920;http://viaf.org/viaf/;29832920;KM 25.06.1812  bis 25.04.1850;AM 18.05.1850 ;;Poisson,  Denis;Poisson; Denis; Denis Poisson;1781;1840;http://viaf.org/viaf/22241140;http://viaf.org/viaf/;22241140;KM 25.06.1812  bis 10.12.1829;AM 11.01.1830 ;;Tiedemann,  Friedrich;Tiedemann; Friedrich; Friedrich Tiedemann;1781;1861;http://viaf.org/viaf/59242363;http://viaf.org/viaf/;59242363;KM 25.06.1812  bis 01.06.1854;AM 15.07.1854 ;;Rühs,  Christian Friedrich;Rühs; Christian Friedrich; Christian Friedrich Rühs;1781;1820;http://viaf.org/viaf/27298922;http://viaf.org/viaf/;27298922;OM 01.01.1819 ;;;Mai,  Angelo;Mai; Angelo; Angelo Mai;1781;1854;http://viaf.org/viaf/100180720;http://viaf.org/viaf/;100180720;KM 28.02.1822  bis 15.06.1854;EM 22.07.1854 ;;Raumer,  Friedrich Ludwig Georg von;Raumer; Friedrich Ludwig Georg von; Friedrich Ludwig Georg von Raumer;1781;1873;http://viaf.org/viaf/64809232;http://viaf.org/viaf/;64809232;OM 18.06.1827 bis 22.03.1847 ;;;Brewster,  Sir David;Brewster; Sir David; Sir David Brewster;1781;1868;http://viaf.org/viaf/2774127;http://viaf.org/viaf/;2774127;KM 13.12.1827  bis 12.02.1846;AM 11.03.1846 ;;Poisson,  Denis;Poisson; Denis; Denis Poisson;1781;1840;http://viaf.org/viaf/22241140;http://viaf.org/viaf/;22241140;KM 25.06.1812  bis 10.12.1829;AM 11.01.1830 ;;Eichhorn,  Karl Friedrich;Eichhorn; Karl Friedrich; Karl Friedrich Eichhorn;1781;1854;http://viaf.org/viaf/5017502;http://viaf.org/viaf/;5017502;OM 13.02.1832 bis 01.01.1847 ;EM 01.01.1847  bis 15.04.1847;AM 15.04.1847 ;Plana, Giovanni Antonio Amedeo;Plana;Giovanni Antonio Amedeo;Giovanni Antonio Amedeo Plana;1781;1864;http://viaf.org/viaf/37842038;http://viaf.org/viaf/;37842038;KM 19.01.1832 ;;;Lobeck,  Christian August;Lobeck; Christian August; Christian August Lobeck;1781;1860;http://viaf.org/viaf/18018430;http://viaf.org/viaf/;18018430;AM 07.05.1832 ;;;Chamisso, Adelbert von;Chamisso;Adelbert von;Adelbert von Chamisso;1781;1838;http://viaf.org/viaf/4927907;http://viaf.org/viaf/;4927907;OM 28.06.1835 ;;;Borghesi,  Bartholomeo ;Borghesi; Bartholomeo ; Bartholomeo  Borghesi;1781;1860;http://viaf.org/viaf/12385911;http://viaf.org/viaf/;12385911;KM 23.06.1836 ;;;Magnüsson,  Finnur;Magnüsson; Finnur; Finnur Magnüsson;1781;1847;http://viaf.org/viaf/59841801;http://viaf.org/viaf/;59841801;KM 23.06.1836 ;;;Brewster,  Sir David;Brewster; Sir David; Sir David Brewster;1781;1868;http://viaf.org/viaf/2774127;http://viaf.org/viaf/;2774127;KM 13.12.1827  bis 12.02.1846;AM 11.03.1846 ;;Eichhorn,  Karl Friedrich;Eichhorn; Karl Friedrich; Karl Friedrich Eichhorn;1781;1854;http://viaf.org/viaf/5017502;http://viaf.org/viaf/;5017502;OM 13.02.1832 bis 01.01.1847 ;EM 01.01.1847  bis 15.04.1847;AM 15.04.1847 ;Tiedemann,  Friedrich;Tiedemann; Friedrich; Friedrich Tiedemann;1781;1861;http://viaf.org/viaf/59242363;http://viaf.org/viaf/;59242363;KM 25.06.1812 bis 01.06.1854 ;AM 15.07.1854 ;;Hausmann,  Johann Friedrich Ludwig;Hausmann; Johann Friedrich Ludwig; Johann Friedrich Ludwig Hausmann;1782;1859;http://viaf.org/viaf/52123978;http://viaf.org/viaf/;52123978;KM 25.06.1812 ;;;QuatremËre, Étienne Marc;QuatremËre;Étienne Marc;Étienne Marc QuatremËre;1782;1857;http://viaf.org/viaf/7482667;http://viaf.org/viaf/;7482667;KM 25.06.1812 ;;;Nitzsch,  Christian Ludwig;Nitzsch; Christian Ludwig; Christian Ludwig Nitzsch;1782;1837;http://viaf.org/viaf/45069813;http://viaf.org/viaf/;45069813;KM 25.06.1818 ;;;Karsten, C. J. B. (Carl Johann Bernhard);Karsten;C. J. B. (Carl Johann Bernhard);C. J. B. (Carl Johann Bernhard) Karsten;1782;1853;http://viaf.org/viaf/34574049;http://viaf.org/viaf/;34574049;OM 18.04.1822 ;;;Hormayr,  Joseph Freiherr von;Hormayr; Joseph Freiherr von; Joseph Freiherr von Hormayr;1782;1848;http://viaf.org/viaf/95217834;http://viaf.org/viaf/;95217834;KM 12.02.1829 ;;;Berthier,  Pierre;Berthier; Pierre; Pierre Berthier;1782;1861;http://viaf.org/viaf/64119606;http://viaf.org/viaf/;64119606;KM 10.12.1829 ;;;Flauti,  Vincenzo;Flauti; Vincenzo; Vincenzo Flauti;1782;1863;http://viaf.org/viaf/54016266;http://viaf.org/viaf/;54016266;KM 10.12.1829 ;;;Pohl,  Johann Emanuel;Pohl; Johann Emanuel; Johann Emanuel Pohl;1782;1834;http://viaf.org/viaf/5359696;http://viaf.org/viaf/;5359696;KM 10.12.1829 ;;;Fischer,  Friedrich Ernst Ludwig von;Fischer; Friedrich Ernst Ludwig von; Friedrich Ernst Ludwig von Fischer;1782;1854;http://viaf.org/viaf/57530335;http://viaf.org/viaf/;57530335;KM 19.01.1832 ;;;Frähn,  Christian Martin Joachim;Frähn; Christian Martin Joachim; Christian Martin Joachim Frähn;1782;1851;http://viaf.org/viaf/12736448;http://viaf.org/viaf/;12736448;KM 19.02.1835 ;;;Wied,  Maximilian Prinz zu;Wied; Maximilian Prinz zu; Maximilian Prinz zu Wied;1782;1867;http://viaf.org/viaf/39504469;http://viaf.org/viaf/;39504469;EM 15.08.1853 ;;;Mai,  Angelo;Mai; Angelo; Angelo Mai;1782;1854;http://viaf.org/viaf/100180720;http://viaf.org/viaf/;100180720;KM 28.02.1822 bis 15.06.1854 ;EM 22.07.1854 ;;Villermé,  Louis-René;Villermé; Louis-René; Louis-René Villermé;1782;1863;http://viaf.org/viaf/24609091;http://viaf.org/viaf/;24609091;KM 14.02.1856 ;;;Oltmanns,  Jabbo;Oltmanns; Jabbo; Jabbo Oltmanns;1783;1833;http://viaf.org/viaf/27183011;http://viaf.org/viaf/;27183011;OM 07.04.1810 bis 23.10.1812 ;EM 23.10.1812  bis 17.03.1825;OM 17.03.1825 ;Oltmanns,  Jabbo;Oltmanns; Jabbo; Jabbo Oltmanns;1783;1833;http://viaf.org/viaf/27183011;http://viaf.org/viaf/;27183011;OM 07.04.1810 bis 23.10.1812 ;EM 23.10.1812  bis 17.03.1825;OM 17.03.1825 ;Oltmanns,  Jabbo;Oltmanns; Jabbo; Jabbo Oltmanns;1783;1833;http://viaf.org/viaf/27183011;http://viaf.org/viaf/;27183011;OM 07.04.1810 bis 23.10.1812 ;EM 23.10.1812  bis 17.03.1825;OM 17.03.1825 ;Serres, Marcel de (Pierre Marcell Toussaint);Serres;Marcel de (Pierre Marcell Toussaint);Marcel de (Pierre Marcell Toussaint) Serres;1783;1862;http://viaf.org/viaf/61536409;http://viaf.org/viaf/;61536409;KM 13.04.1826 ;;;Carlini,  Francesco;Carlini; Francesco; Francesco Carlini;1783;1862;http://viaf.org/viaf/39366577;http://viaf.org/viaf/;39366577;KM 22.06.1826 ;;;Chambray, Georges, marquis de;Chambray;Georges, marquis de;Georges, marquis de Chambray;1783;1848;http://viaf.org/viaf/19775981;http://viaf.org/viaf/;19775981;KM 20.06.1833 ;;;Geijer,  Erik Gustav;Geijer; Erik Gustav; Erik Gustav Geijer;1783;1847;http://viaf.org/viaf/7563820;http://viaf.org/viaf/;7563820;KM 23.06.1836 ;;;Serradifalco,  Domenico Lo Faso Pietrasanta;Serradifalco; Domenico Lo Faso Pietrasanta; Domenico Lo Faso Pietrasanta Serradifalco;1783;1863;http://viaf.org/viaf/10278466;http://viaf.org/viaf/;10278466;EM 29.07.1836 ;;;Molbech,  Christian;Molbech; Christian; Christian Molbech;1783;1857;http://viaf.org/viaf/2582571;http://viaf.org/viaf/;2582571;KM 27.02.1845 ;;;Lajard,  Jean-Baptiste-Félix;Lajard; Jean-Baptiste-Félix; Jean-Baptiste-Félix Lajard;1783;1858;http://viaf.org/viaf/769603;http://viaf.org/viaf/;769603;KM 17.12.1846 ;;;Bessel,  Friedrich Wilhelm;Bessel; Friedrich Wilhelm; Friedrich Wilhelm Bessel;1784;1846;http://viaf.org/viaf/4929529;http://viaf.org/viaf/;4929529;AM 16.07.1812 ;;;Thiersch,  Friedrich von;Thiersch; Friedrich von; Friedrich von Thiersch;1784;1860;http://viaf.org/viaf/62345630;http://viaf.org/viaf/;62345630;KM 09.06.1825  bis 25.03.1858;AM 27.04.1858 ;;Hansteen,  Christopher;Hansteen; Christopher; Christopher Hansteen;1784;1873;http://viaf.org/viaf/15520384;http://viaf.org/viaf/;15520384;KM 13.12.1827 ;;;Welcker,  Friedrich Gottlieb;Welcker; Friedrich Gottlieb; Friedrich Gottlieb Welcker;1784;1868;http://viaf.org/viaf/39414089;http://viaf.org/viaf/;39414089;AM 11.03.1846 ;;;Radhakanta Deb, ;Radhakanta Deb;; Radhakanta Deb;1784;1867;http://viaf.org/viaf/35295986;http://viaf.org/viaf/;35295986;EM 27.04.1858 ;;;Thiersch,  Friedrich von;Thiersch; Friedrich von; Friedrich von Thiersch;1784;1860;http://viaf.org/viaf/62345630;http://viaf.org/viaf/;62345630;KM 09.06.1825 bis 25.03.1858 ;AM 27.04.1858 ;;Böckh,  August;Böckh; August; August Böckh;1785;1867;http://viaf.org/viaf/37048283;http://viaf.org/viaf/;37048283;OM 14.05.1814 ;;;Bekker,  August Emanuel;Bekker; August Emanuel; August Emanuel Bekker;1785;1871;http://viaf.org/viaf/44387193;http://viaf.org/viaf/;44387193;OM 03.05.1815 ;;;Mustoxydis,  Andreas;Mustoxydis; Andreas; Andreas Mustoxydis;1785;1860;http://viaf.org/viaf/73981582;http://viaf.org/viaf/;73981582;KM 22.06.1815 ;;;Grimm,  Jacob Ludwig Karl;Grimm; Jacob Ludwig Karl; Jacob Ludwig Karl Grimm;1785;1863;http://viaf.org/viaf/31997136;http://viaf.org/viaf/;31997136;KM 22.06.1826  bis 12.04.1832;AM 07.05.1832  bis 09.03.1841;OM 09.03.1841 ;Dulong,  Pierre-Louis;Dulong; Pierre-Louis; Pierre-Louis Dulong;1785;1838;http://viaf.org/viaf/25331095;http://viaf.org/viaf/;25331095;KM 13.12.1827 ;;;Ledebour, Carl Friedrich von;Ledebour;Carl Friedrich von;Carl Friedrich von Ledebour;1785;1851;http://viaf.org/viaf/64768440;http://viaf.org/viaf/;64768440;KM 19.01.1832 ;;;Grimm,  Jacob Ludwig Karl;Grimm; Jacob Ludwig Karl; Jacob Ludwig Karl Grimm;1785;1863;http://viaf.org/viaf/31997136;http://viaf.org/viaf/;31997136;KM 22.06.1826  bis 12.04.1832;AM 07.05.1832  bis 09.03.1841;OM 09.03.1841 ;Hooker,  Sir William Jackson;Hooker; Sir William Jackson; Sir William Jackson Hooker;1785;1865;http://viaf.org/viaf/46874997;http://viaf.org/viaf/;46874997;KM 13.02.1834  bis 26.07.1855;EM 15.08.1855 ;;Vigors,  Nicholas Aylward;Vigors; Nicholas Aylward; Nicholas Aylward Vigors;1785;1840;http://viaf.org/viaf/40162259;http://viaf.org/viaf/;40162259;KM 13.02.1834 ;;;Peyron,  Vittorio Amedeo;Peyron; Vittorio Amedeo; Vittorio Amedeo Peyron;1785;1870;http://viaf.org/viaf/19835436;http://viaf.org/viaf/;19835436;KM 18.02.1836 ;;;Schmeller,  Johann Andreas;Schmeller; Johann Andreas; Johann Andreas Schmeller;1785;1852;http://viaf.org/viaf/88892462;http://viaf.org/viaf/;88892462;KM 18.02.1836 ;;;Grimm,  Jacob Ludwig Karl;Grimm; Jacob Ludwig Karl; Jacob Ludwig Karl Grimm;1785;1863;http://viaf.org/viaf/31997136;http://viaf.org/viaf/;31997136;KM 22.06.1826  bis 12.04.1832;AM 07.05.1832  bis 09.03.1841;OM 09.03.1841 ;Wheaton,  Henry;Wheaton; Henry; Henry Wheaton;1785;1848;http://viaf.org/viaf/49274108;http://viaf.org/viaf/;49274108;EM 30.09.1843 ;;;Dahlmann,  Friedrich Christoph;Dahlmann; Friedrich Christoph; Friedrich Christoph Dahlmann;1785;1860;http://viaf.org/viaf/68943247;http://viaf.org/viaf/;68943247;KM 27.02.1845 ;;;Hooker,  Sir William Jackson;Hooker; Sir William Jackson; Sir William Jackson Hooker;1785;1865;http://viaf.org/viaf/46874997;http://viaf.org/viaf/;46874997;KM 13.02.1834 bis 26.07.1855 ;EM 15.08.1855 ;;Gesenius,  Heinrich Friedrich Wilhelm;Gesenius; Heinrich Friedrich Wilhelm; Heinrich Friedrich Wilhelm Gesenius;1786;1842;http://viaf.org/viaf/51807594;http://viaf.org/viaf/;51807594;KM 22.06.1826 ;;;Arago,  Dominique-Françﬂois-Jean;Arago; Dominique-Françﬂois-Jean; Dominique-Françﬂois-Jean Arago;1786;1853;http://viaf.org/viaf/64023378;http://viaf.org/viaf/;64023378;AM 04.01.1828 ;;;Otto,  Adolf Wilhelm;Otto; Adolf Wilhelm; Adolf Wilhelm Otto;1786;1845;http://viaf.org/viaf/13077935;http://viaf.org/viaf/;13077935;KM 19.01.1832 ;;;Wallich,  Nathanael;Wallich; Nathanael; Nathanael Wallich;1786;1854;http://viaf.org/viaf/9962177;http://viaf.org/viaf/;9962177;KM 19.01.1832 ;;;Grimm,  Wilhelm Karl;Grimm; Wilhelm Karl; Wilhelm Karl Grimm;1786;1859;http://viaf.org/viaf/31997136;http://viaf.org/viaf/;31997136;KM 12.04.1832  bis 11.02.1841;OM 09.03.1841 ;;Chevreul, Michel EugËne;Chevreul;Michel EugËne;Michel EugËne Chevreul;1786;1889;http://viaf.org/viaf/100196127;http://viaf.org/viaf/;100196127;KM 05.06.1834  bis 22.07.1880;AM 16.08.1880 ;;Amici,  Giovanni Battista;Amici; Giovanni Battista; Giovanni Battista Amici;1786;1864;http://viaf.org/viaf/15020565;http://viaf.org/viaf/;15020565;KM 01.12.1836 ;;;